{
  "schema_version": "1.0",
  "job_id": "example-complaints-unknown",
  "episode_id": "example-synthetic-episode",
  "module_id": "complaints",
  "module_version": "0.1.0",
  "input_artifacts": [
    {
      "artifact_id": "artifact-ad9c92a0b3892d2bc13af8ae7130118010e1babf58f12225ac535ecd390c4a82",
      "storage_key": "artifacts/ad9c92a0b3892d2bc13af8ae7130118010e1babf58f12225ac535ecd390c4a82",
      "sha256": "ad9c92a0b3892d2bc13af8ae7130118010e1babf58f12225ac535ecd390c4a82",
      "media_type": "application/json",
      "size_bytes": 741,
      "role": "source"
    }
  ],
  "parameters": {},
  "protocol_id": "synthetic-intake-v1"
}
